{
  "$schema": "http://json-schema.org/draft-07/schema#",
  "$id": "https://aicore.dev/schemas/agent/fix-response-1.0.schema.json",
  "title": "AIC Agent Fix Response v1.0",
  "type": "object",
  "additionalProperties": false,
  "required": [
    "protocol_version",
    "phase",
    "mode",
    "ok",
    "files_changed",
    "applied_edits",
    "conflicts",
    "diagnostics"
  ],
  "properties": {
    "protocol_version": {
      "const": "1.0"
    },
    "phase": {
      "const": "fix"
    },
    "mode": {
      "type": "string",
      "enum": [
        "dry-run",
        "apply"
      ]
    },
    "ok": {
      "type": "boolean"
    },
    "files_changed": {
      "type": "array",
      "items": {
        "type": "string"
      }
    },
    "applied_edits": {
      "type": "array",
      "items": {
        "$ref": "#/$defs/edit"
      }
    },
    "conflicts": {
      "type": "array",
      "items": {
        "$ref": "#/$defs/edit"
      }
    },
    "diagnostics": {
      "type": "array",
      "items": {
        "$ref": "#/$defs/diagnostic"
      }
    }
  },
  "$defs": {
    "edit": {
      "type": "object",
      "additionalProperties": false,
      "required": [
        "file",
        "start",
        "end",
        "replacement",
        "message"
      ],
      "properties": {
        "file": {
          "type": "string"
        },
        "start": {
          "type": "integer",
          "minimum": 0
        },
        "end": {
          "type": "integer",
          "minimum": 0
        },
        "replacement": {
          "type": "string"
        },
        "message": {
          "type": "string"
        }
      }
    },
    "diagnostic": {
      "type": "object",
      "additionalProperties": false,
      "required": [
        "code",
        "severity",
        "message",
        "spans",
        "help",
        "suggested_fixes"
      ],
      "properties": {
        "code": {
          "type": "string"
        },
        "severity": {
          "type": "string",
          "enum": [
            "error",
            "warning",
            "note"
          ]
        },
        "message": {
          "type": "string"
        },
        "spans": {
          "type": "array",
          "items": {
            "type": "object",
            "additionalProperties": false,
            "required": [
              "file",
              "start",
              "end",
              "label"
            ],
            "properties": {
              "file": {
                "type": "string"
              },
              "start": {
                "type": "integer",
                "minimum": 0
              },
              "end": {
                "type": "integer",
                "minimum": 0
              },
              "label": {
                "type": [
                  "string",
                  "null"
                ]
              },
              "start_line": {
                "type": "integer",
                "minimum": 1,
                "description": "1-based line of `start`; present when the source file is readable."
              },
              "start_column": {
                "type": "integer",
                "minimum": 1,
                "description": "1-based column of `start`, counted in Unicode scalar values."
              },
              "end_line": {
                "type": "integer",
                "minimum": 1,
                "description": "1-based line of `end`."
              },
              "end_column": {
                "type": "integer",
                "minimum": 1,
                "description": "1-based column of `end` (exclusive, like `end`)."
              }
            }
          }
        },
        "help": {
          "type": "array",
          "items": {
            "type": "string"
          }
        },
        "suggested_fixes": {
          "type": "array",
          "items": {
            "type": "object",
            "additionalProperties": false,
            "required": [
              "message",
              "replacement",
              "start",
              "end"
            ],
            "properties": {
              "message": {
                "type": "string"
              },
              "replacement": {
                "type": [
                  "string",
                  "null"
                ]
              },
              "start": {
                "type": [
                  "integer",
                  "null"
                ],
                "minimum": 0
              },
              "end": {
                "type": [
                  "integer",
                  "null"
                ],
                "minimum": 0
              }
            }
          }
        },
        "reasoning": {
          "$ref": "#/$defs/diagnostic_reasoning"
        }
      }
    },
    "diagnostic_reasoning": {
      "type": "object",
      "additionalProperties": false,
      "required": [
        "schema_version",
        "strategy",
        "summary",
        "confidence",
        "evidence",
        "hypotheses",
        "next_actions",
        "spec_refs"
      ],
      "properties": {
        "schema_version": {
          "const": "1.0"
        },
        "strategy": {
          "type": "string"
        },
        "summary": {
          "type": "string"
        },
        "confidence": {
          "type": "integer",
          "minimum": 0,
          "maximum": 100
        },
        "evidence": {
          "type": "array",
          "items": {
            "type": "string"
          }
        },
        "hypotheses": {
          "type": "array",
          "items": {
            "$ref": "#/$defs/diagnostic_hypothesis"
          }
        },
        "next_actions": {
          "type": "array",
          "items": {
            "type": "string"
          }
        },
        "spec_refs": {
          "type": "array",
          "items": {
            "type": "string"
          }
        }
      }
    },
    "diagnostic_hypothesis": {
      "type": "object",
      "additionalProperties": false,
      "required": [
        "kind",
        "title",
        "detail",
        "confidence"
      ],
      "properties": {
        "kind": {
          "type": "string"
        },
        "title": {
          "type": "string"
        },
        "detail": {
          "type": "string"
        },
        "confidence": {
          "type": "integer",
          "minimum": 0,
          "maximum": 100
        }
      }
    }
  }
}
